{
  "gtm": {
    "enabled": true,
    "containerId": "GTM-P6GKJ7BF"
  },
  "ga4": {
    "enabled": true,
    "measurementId": "G-PN1VH0CF79",
    "viaGtmOnly": false
  },
  "firebase": {
    "enabled": true,
    "config": {
      "apiKey": "AIzaSyCBQUN5nlvlol_fAxja1-O21gprQZNCkVM",
      "authDomain": "audit-educa-system.firebaseapp.com",
      "projectId": "audit-educa-system",
      "storageBucket": "audit-educa-system.firebasestorage.app",
      "messagingSenderId": "491204425302",
      "appId": "1:491204425302:web:3b0edcc719a1110640adf7"
    }
  },
  "consent": {
    "required": true,
    "defaultAnalytics": false
  }
}
